{
  "timestamp": "2025-08-24T16:01:29.539968",
  "tipo_analise": "completa",
  "modelo_utilizado": "gemini-2.5-pro",
  "resultados_originais": {
    "tipo_varredura": "completo",
    "timestamp": "2024-08-24T00:00:00",
    "sucesso": true,
    "dados": {
      "resumo": {
        "hosts_total": 1,
        "hosts_ativos": 1,
        "portas_abertas": 5,
        "servicos_detectados": 3,
        "vulnerabilidades": 2
      },
      "hosts": [
        {
          "endereco": "192.168.1.100",
          "hostname": "test-server.local",
          "status": "up",
          "os": {
            "nome": "Linux 4.x",
            "precisao": "95",
            "familia": "Linux"
          },
          "portas": [
            {
              "numero": 22,
              "protocolo": "tcp",
              "estado": "open",
              "servico": "ssh",
              "produto": "OpenSSH",
              "versao": "7.4",
              "scripts": []
            },
            {
              "numero": 80,
              "protocolo": "tcp",
              "estado": "open",
              "servico": "http",
              "produto": "Apache",
              "versao": "2.4.6",
              "scripts": [
                {
                  "id": "http-vuln-cve2017-5638",
                  "saida": "Vulnerabilidade Apache Struts encontrada",
                  "elementos": []
                }
              ]
            },
            {
              "numero": 443,
              "protocolo": "tcp",
              "estado": "open",
              "servico": "https",
              "produto": "Apache",
              "versao": "2.4.6",
              "scripts": []
            },
            {
              "numero": 3306,
              "protocolo": "tcp",
              "estado": "open",
              "servico": "mysql",
              "produto": "MySQL",
              "versao": "5.5.62",
              "scripts": [
                {
                  "id": "mysql-vuln-cve2012-2122",
                  "saida": "Vulnerabilidade de autenticação MySQL",
                  "elementos": []
                }
              ]
            },
            {
              "numero": 5432,
              "protocolo": "tcp",
              "estado": "open",
              "servico": "postgresql",
              "produto": "PostgreSQL",
              "versao": "9.6.2",
              "scripts": []
            }
          ],
          "scripts": []
        }
      ]
    }
  },
  "analise_ia": "Com certeza. Aqui está uma análise de segurança detalhada com base nos resultados da varredura Nmap fornecidos.\n\n---\n\n### **Análise de Segurança do Servidor: test-server.local (192.168.1.100)**\n\n#### **1. Resumo Executivo dos Achados**\n\nA varredura de segurança no servidor `test-server.local` (IP `192.168.1.100`) identificou **duas vulnerabilidades de risco CRÍTICO** que expõem o sistema a um comprometimento total e imediato.\n\nA principal ameaça é uma vulnerabilidade de **Execução Remota de Código (RCE)** no serviço web (Apache Struts), que permite a um invasor executar comandos arbitrários no servidor. A segunda vulnerabilidade crítica permite a **quebra de autenticação no banco de dados MySQL**, garantindo acesso não autorizado aos dados armazenados.\n\nAdicionalmente, todos os serviços identificados (SSH, Apache, MySQL, PostgreSQL) estão executando versões significativamente desatualizadas, indicando uma falha sistêmica na gestão de atualizações (patch management). O servidor apresenta uma superfície de ataque ampla e mal protegida, exigindo ação corretiva imediata para prevenir um incidente de segurança grave.\n\n#### **2. Vulnerabilidades Identificadas e Nível de Risco**\n\nA seguir, detalhamos as vulnerabilidades encontradas, classificadas por seu nível de risco.\n\n##### **a) CVE-2017-5638: Execução Remota de Código no Apache Struts**\n- **Serviço Afetado:** Apache (Portas 80/tcp e 443/tcp)\n- **Nível de Risco:** **CRÍTICO**\n- **Descrição:** Esta vulnerabilidade, também conhecida como \"Struts-Shock\", permite que um invasor não autenticado execute comandos arbitrários no sistema operacional do servidor através do envio de um cabeçalho `Content-Type` maliciosamente criado. A exploração é trivial e existem ferramentas públicas amplamente disponíveis para automatizá-la.\n- **Impacto Potencial:**\n    - **Comprometimento total do servidor:** O invasor pode obter um shell reverso, ganhando controle sobre o sistema com os privilégios do usuário do serviço web (ex: `www-data` ou `apache`).\n    - **Roubo de dados:** Acesso completo a todos os arquivos da aplicação, incluindo códigos-fonte, chaves de API e credenciais de banco de dados.\n    - **Instalação de malware:** Implantação de ransomware, mineradores de criptomoedas ou backdoors para acesso persistente.\n    - **Pivô para a rede interna:** Uso do servidor comprometido como uma ponte para atacar outros sistemas dentro da rede local.\n\n##### **b) CVE-2012-2122: Falha de Autenticação no MySQL**\n- **Serviço Afetado:** MySQL (Porta 3306/tcp)\n- **Nível de Risco:** **CRÍTICO**\n- **Descrição:** Esta vulnerabilidade ocorre devido a um erro de comparação de memória (`memcmp`) durante o processo de autenticação. Um invasor pode tentar autenticar-se repetidamente com uma senha incorreta e, em aproximadamente 1 a cada 256 tentativas, a autenticação será bem-sucedida, concedendo acesso ao banco de dados.\n- **Impacto Potencial:**\n    - **Acesso não autorizado aos dados:** Leitura, modificação e exclusão de todas as informações armazenadas no banco de dados, incluindo dados de clientes, informações financeiras e credenciais de usuários.\n    - **Violação de dados (Data Breach):** Exposição de dados sensíveis, resultando em danos reputacionais e multas regulatórias (como a LGPD).\n    - **Negação de Serviço (DoS):** Um invasor pode apagar tabelas ou corromper o banco de dados, tornando a aplicação inutilizável.\n\n##### **c) Software Desatualizado em Todos os Serviços**\n- **Serviços Afetados:** OpenSSH 7.4 (2016), Apache 2.4.6 (2013), MySQL 5.5.62 (2018), PostgreSQL 9.6.2 (2017), Linux Kernel 4.x.\n- **Nível de Risco:** **ALTO**\n- **Descrição:** Todas as versões de software identificadas estão obsoletas e não recebem mais atualizações de segurança. Isso significa que, além das vulnerabilidades já detectadas, existem dezenas de outras vulnerabilidades conhecidas (e não testadas por esses scripts Nmap) que podem ser exploradas.\n- **Impacto Potencial:** A falta de atualizações é a causa raiz das vulnerabilidades críticas encontradas e indica que o servidor é vulnerável a uma vasta gama de ataques já conhecidos.\n\n#### **3. Recomendações de Segurança Prioritárias**\n\nAs ações devem ser tomadas na seguinte ordem de prioridade:\n\n**Prioridade 1: Ações Imediatas (Contenção)**\n\n1.  **Corrigir a Vulnerabilidade do Apache Struts (CVE-2017-5638):**\n    - **Ação Ideal:** Atualizar a biblioteca Apache Struts para a versão mais recente e segura.\n    - **Ação Paliativa:** Se a atualização não for possível imediatamente, implementar uma regra em um Web Application Firewall (WAF) para bloquear requisições com o cabeçalho `Content-Type` malicioso ou isolar o servidor da rede até que a correção seja aplicada.\n2.  **Corrigir a Vulnerabilidade do MySQL (CVE-2012-2122):**\n    - **Ação Ideal:** Atualizar o servidor MySQL para uma versão recente e corrigida (ex: 5.7+ ou 8.x).\n    - **Ação Paliativa:** Restringir o acesso à porta 3306 via firewall. Apenas o servidor de aplicação deve ter permissão para se conectar a esta porta. Ela **não deve estar exposta** para toda a rede.\n\n**Prioridade 2: Ações de Curto Prazo (Remediação)**\n\n3.  **Implementar um Plano de Gestão de Atualizações (Patch Management):**\n    - Atualizar o sistema operacional (Linux 4.x está obsoleto) e todos os pacotes de software, incluindo Apache, OpenSSH e PostgreSQL.\n    - Estabelecer uma política para aplicar atualizações de segurança regularmente.\n4.  **Revisar Regras de Firewall:**\n    - Aplicar o princípio do menor privilégio. As portas de banco de dados (3306 e 5432) não devem ser acessíveis publicamente ou de segmentos de rede desnecessários. Limite o acesso apenas aos hosts que precisam se comunicar com esses serviços.\n\n**Prioridade 3: Ações de Médio Prazo (Fortalecimento)**\n\n5.  **Realizar Hardening do Servidor:**\n    - Revisar as configurações de todos os serviços (SSH, Apache, etc.) para seguir as melhores práticas de segurança. Ex: desabilitar login de root via SSH, usar autenticação baseada em chaves, remover módulos desnecessários do Apache.\n6.  **Implementar Monitoramento de Segurança:**\n    - Configurar logs detalhados para todos os serviços e centralizá-los em um sistema de SIEM (Security Information and Event Management) para detectar atividades suspeitas.\n\n#### **4. Análise de Superfície de Ataque**\n\nA superfície de ataque deste servidor é perigosamente grande e exposta:\n\n-   **Vetor de Entrada Principal (Aplicação Web):** As portas 80 e 443 representam o ponto de entrada mais provável e danoso, devido à vulnerabilidade de RCE no Apache Struts. Um invasor pode obter controle total do servidor através deste vetor sem precisar de credenciais.\n-   **Vetor de Entrada de Dados (Bancos de Dados):** As portas 3306 e 5432 expõem diretamente os bancos de dados à rede. Com a vulnerabilidade no MySQL, este é um caminho direto para o roubo de dados, o \"ativo\" mais valioso da organização.\n-   **Vetor de Acesso Administrativo (SSH):** A porta 22, embora não tenha uma vulnerabilidade crítica apontada pelo script, está exposta a ataques de força bruta. A versão antiga do OpenSSH pode conter outras falhas que permitiriam a um invasor contornar mecanismos de segurança.\n\nA combinação de um vetor de RCE na camada web e um vetor de acesso direto ao banco de dados torna este servidor um alvo extremamente fácil e de alto valor para invasores.\n\n#### **5. Próximos Passos Sugeridos para Pentest**\n\nPara aprofundar a análise e demonstrar o impacto real, os próximos passos de um teste de invasão (pentest) seriam:\n\n1.  **Fase de Exploração:**\n    - **Prova de Conceito (PoC) para CVE-2017-5638:** Utilizar ferramentas como Metasploit ou scripts customizados para validar a vulnerabilidade de RCE. O objetivo é obter um shell no servidor para demonstrar o controle total.\n    - **Prova de Conceito (PoC) para CVE-2012-2122:** Desenvolver ou usar um script para automatizar as tentativas de login no MySQL e comprovar o acesso não autorizado. Uma vez dentro, listar usuários e bancos de dados como evidência.\n\n2.  **Fase de Pós-Exploração:**\n    - **Escalonamento de Privilégios:** Após obter um shell com privilégios de usuário web, buscar por falhas de configuração locais, senhas em arquivos de configuração (`wp-config.php`, `settings.py`, etc.) ou vulnerabilidades no kernel do Linux 4.x para escalar os privilégios para `root`.\n    - **Movimentação Lateral:** A partir do servidor comprometido, escanear a rede interna para identificar outros alvos. Usar as credenciais encontradas no servidor para tentar acessar outros sistemas (pivoting).\n\n3.  **Análise Adicional:**\n    - **Ataque de Força Bruta:** Realizar ataques de força bruta com dicionários de senhas comuns contra os serviços SSH (porta 22) e PostgreSQL (porta 5432).\n    - **Análise da Aplicação Web:** Utilizar ferramentas como Burp Suite ou OWASP ZAP para realizar uma análise dinâmica da aplicação web em busca de outras falhas, como SQL Injection, Cross-Site Scripting (XSS) e Insecure Direct Object References (IDOR), que o Nmap não detectaria.",
  "resumo_tecnico": "Com certeza. Aqui está uma análise de segurança detalhada com base nos resultados da varredura Nmap fornecidos. --- A varredura de segurança no servidor `test-server.local` (IP `192.168.1.100`) identificou **duas vulnerabilidades de risco CRÍTICO** que expõem o sistema a um comprometimento total e imediato.",
  "nivel_risco_geral": "Alto",
  "recomendacoes_prioritarias": [
    "Prioridade 1: Ações Imediatas (Contenção)**",
    "Corrigir a Vulnerabilidade do Apache Struts (CVE-2017-5638):**",
    "Ação Ideal:** Atualizar a biblioteca Apache Struts para a versão mais recente e segura.",
    "Ação Paliativa:** Se a atualização não for possível imediatamente, implementar uma regra em um Web Application Firewall (WAF) para bloquear requisições com o cabeçalho `Content-Type` malicioso ou isolar o servidor da rede até que a correção seja aplicada.",
    "Corrigir a Vulnerabilidade do MySQL (CVE-2012-2122):**"
  ]
}